category,slug,full_product_name
The Library,beekeeping-for-dummies-blackiston,Beekeeping For Dummies (For Dummies (Lifestyle)) by Howland Blackiston
The Library,backyard-beekeeper-flottum,"The Backyard Beekeeper, 4th Edition: An Absolute Beginner's Guide to Keeping Bees in Your Yard and Garden"
The Library,beekeepers-bible-jones,"The Beekeeper's Bible: Bees, Honey, Recipes & Other Home Uses"
The Library,beekeepers-handbook-sammataro,The Beekeeper's Handbook by Diana Sammataro and Alphonse Avitabile
The Library,natural-beekeeping-conrad,"Natural Beekeeping: Organic Approaches to Modern Apiculture, 2nd Edition"
The Library,honey-bee-biology-caron,"Honey Bee Biology and Beekeeping, Revised Edition by Dewey M. Caron"
The Library,honeybee-democracy-seeley,Honeybee Democracy by Thomas D. Seeley
The Library,practical-beekeeper-bush,The Practical Beekeeper: Beekeeping Naturally by Michael Bush
The Library,top-bar-beekeeping-crowder,Top-Bar Beekeeping: Organic Practices for Honeybee Health by Les Crowder
The Library,beekeepers-problem-solver-tew,The Beekeeper's Problem Solver: 100 Common Problems Explored and Explained
The Wardrobe,guardian-bee-apparel-ventilated-suit,Guardian Bee Apparel - Ultra-Ventilated Full Beekeeping Suit with Self-Supporting Fencing Veil
The Wardrobe,humble-bee-420-aero-suit,Humble Bee 420 Aero Beekeeping Suit with Round Veil
The Wardrobe,ultra-breeze-beekeeping-jacket,Ultra Breeze Large Beekeeping Jacket with Fencing Veil
The Wardrobe,apis-tactical-ventilated-suit,Apis Tactical Ventilated 3-Layer Mesh Beekeeping Suit
The Wardrobe,natural-apiary-max-protect-suit,Natural Apiary Max Protect Beekeeping Suit - White Polycotton
The Wardrobe,beeline-ventilated-gloves,Beeline Ventilated Beekeeping Gloves with Goatskin Leather
The Wardrobe,foxhound-bee-company-leather-gloves,Foxhound Bee Company Premium Goatskin Beekeeping Gloves
The Hive Body,flow-hive-2-plus,Flow Hive 2+ Araucaria 6 Frame Langstroth Beehive
The Hive Body,apimaye-insulated-bee-hive,Apimaye 10 Frame Insulated Langstroth Beehive Set
The Hive Body,hoover-hives-10-frame-beehive,Hoover Hives 10 Frame Langstroth Beehive Wax Coated Includes Frames and Foundations
The Hive Body,beecastle-8-frame-beehive,BeeCastle 8 Frame Complete Beehive Kit Wax Coated Cedar Wood
The Hive Body,mann-lake-10-frame-kit,Mann Lake 10-Frame Complete Beehive Kit Fully Assembled
The Hive Body,acorn-plastic-frames-heavy-wax,Acorn Beekeeping Equipment One Piece Plastic Frame and Foundation - Heavy Waxed
The Tool Belt,dadant-stainless-steel-smoker,Dadant 4 x 7 Inch Stainless Steel Smoker with Guard and Hook
The Tool Belt,mann-lake-pro-smoker-guard,Mann Lake Stainless Steel Pro Smoker with Guard
The Tool Belt,j-hook-hive-tool-maxant,Maxant Stainless Steel J-Hook Hive Tool
The Tool Belt,bee-brush-horsehair-natural,Natural Horsehair Bee Brush with Wooden Handle
The Tool Belt,varroa-check-alcohol-wash-kit,Varroa EasyCheck Mite Monitoring Shaker Kit
The Tool Belt,bee-smart-ultimate-feeder,Bee Smart Ultimate In-Hive Feeder for 8 and 10 Frame Hives
The Harvest Lab,vivohome-electric-honey-extractor,VIVOHOME 4 Frame Electric Honey Extractor Stainless Steel
The Harvest Lab,mann-lake-manual-2-frame-extractor,Mann Lake HH160 2-Frame Plastic Manual Honey Extractor
The Harvest Lab,honey-strainer-double-sieve-stainless,Stainless Steel Honey Strainer Double Sieve with Extendable Arms
The Harvest Lab,electric-uncapping-knife-pierce,Pierce-Mears Electric Uncapping Knife with Pre-set Thermostat
The Harvest Lab,honey-refractometer-brix-scale,"Honey Refractometer for Honey Moisture, Brix and Baumé, 3-in-1 Uses"
